{
  "schema_version": "0.1.0",
  "id": "collection-example-annals",
  "type": "collection",
  "form": "annals",
  "title": "编年体结构示例",
  "summary": "仅演示按事件时间排序。",
  "order": "chronological",
  "focus_ids": [],
  "event_ids": ["event-example-structure"],
  "related_collection_ids": [],
  "privacy": {"risk": "none", "handling": "as-recorded", "indexing": "include", "notes": null},
  "provenance": {"created_by": "human", "created_at": "2026-09-02T00:00:00Z", "contributors": [], "agent_run_id": null, "input_hashes": []},
  "narrative": null
}
